{
  "$schema": "https://json-schema.org/draft/2020-12/schema",
  "$id": "https://vivolution.ae/schemas/voice-platform-release-manifest-v1.json",
  "title": "Vivolution Voice Platform release manifest",
  "type": "object",
  "additionalProperties": false,
  "required": ["schema_version", "product", "release", "source_commit", "roles", "artifact", "sbom", "published_at"],
  "properties": {
    "schema_version": {"const": 1},
    "product": {"const": "Vivolution Voice Platform"},
    "release": {"type": "string", "pattern": "^0\\.[0-9]+\\.[0-9]+(?:-rc[1-9][0-9]*)?$"},
    "source_commit": {"type": "string", "pattern": "^[0-9a-f]{40}$"},
    "published_at": {"type": "string", "format": "date-time"},
    "roles": {
      "type": "array",
      "items": {"enum": ["controller", "edge"]},
      "minItems": 1,
      "uniqueItems": true
    },
    "artifact": {
      "type": "object",
      "additionalProperties": false,
      "required": ["name", "url", "sha256", "bytes", "archive_root", "entrypoint", "os", "architecture"],
      "properties": {
        "name": {"type": "string", "pattern": "^[A-Za-z0-9][A-Za-z0-9._-]{0,199}$"},
        "url": {
          "type": "string",
          "format": "uri",
          "pattern": "^https://github\\.com/vivolution/vivolution-voice-platform-install/releases/download/v0\\.[0-9]+\\.[0-9]+(?:-rc[1-9][0-9]*)?/[A-Za-z0-9][A-Za-z0-9._-]{0,199}$"
        },
        "sha256": {"type": "string", "pattern": "^[0-9a-f]{64}$"},
        "bytes": {"type": "integer", "minimum": 1, "maximum": 268435456},
        "archive_root": {"type": "string", "pattern": "^[A-Za-z0-9][A-Za-z0-9._-]{0,199}$"},
        "entrypoint": {"const": "installer/install.sh"},
        "os": {"const": "debian-13"},
        "architecture": {"const": "amd64"}
      }
    },
    "sbom": {
      "type": "object",
      "additionalProperties": false,
      "required": ["name", "url", "sha256"],
      "properties": {
        "name": {"type": "string", "pattern": "^[A-Za-z0-9][A-Za-z0-9._-]{0,199}$"},
        "url": {
          "type": "string",
          "format": "uri",
          "pattern": "^https://github\\.com/vivolution/vivolution-voice-platform-install/releases/download/v0\\.[0-9]+\\.[0-9]+(?:-rc[1-9][0-9]*)?/[A-Za-z0-9][A-Za-z0-9._-]{0,199}$"
        },
        "sha256": {"type": "string", "pattern": "^[0-9a-f]{64}$"}
      }
    }
  }
}
